,"Microsoft Office Home and Business 2013, 32-bit/x64, English ","Sector 4, Bucharest, Romania",44.3753564,26.1218478,TOP OFFICE INTERNATIONAL SRL,2015-07-15,,29833.88,EURO,0,17196,48218000-9,DA7069195,Directia Impozite si Taxe Locale sector 5
,SCANER A4 PENTRU DOCUMENTE EPSON WORKFORCE DS-520 ,"Sector 4, Bucharest, Romania",44.3753564,26.1217478,TOP OFFICE INTERNATIONAL SRL,2015-07-09,,23634.34,EURO,0,14542,38520000-6,DA7048938,Directia Impozite si Taxe Locale sector 5
,DACIA DUSTER LAUREATE,"Sector 4, Bucharest, Romania",44.3753564,26.1216478,AUTO COBALCESCU SRL,2015-09-01,,14378.49,EURO,0,13326,34113300-5,DA7231677,Directia Impozite si Taxe Locale sector 5
,DACIA LOGAN AMBIANCE,"Sector 4, Bucharest, Romania",44.3753564,26.1215478,AUTO COBALCESCU SRL,2015-09-01,,8557.18,EURO,0,13322,34111200-0,DA7231631,Directia Impozite si Taxe Locale sector 5
,"SISTEM DESKTOP, Procesor Intel Core i3 3250 3.5GHz box ","Sector 4, Bucharest, Romania",44.3754564,26.1218478,ASTRA PLUS SRL,2015-07-28,,4477,EURO,0,11750,30141200-1,DA7107062,Directia Impozite si Taxe Locale sector 5
,SCAUN ERGONOMIC ,"Sector 4, Bucharest, Romania",44.3754564,26.1217478,OFFICE&MORE SRL,2015-07-10,,3840.8,EURO,0,14665,39113000-7,DA7049018,Directia Impozite si Taxe Locale sector 5
,Modul integrare plati externe ,"Sector 4, Bucharest, Romania",44.3754564,26.1216478,INTEGRISOFT SOLUTIONS S.R.L.,2015-08-13,,3795.53,EURO,0,17168,48000000-8,DA7167884,Directia Impozite si Taxe Locale sector 5
,UPS G-Tec 1000VA ,"Sector 4, Bucharest, Romania",44.3754564,26.1215478,Glob Star Trade S.R.L.,2015-07-14,,3145.36,EURO,0,12121,31154000-0,DA7063329,Directia Impozite si Taxe Locale sector 5
,Distrugator documente,"Sector 4, Bucharest, Romania",44.3755564,26.1218478,ASTRA PLUS SRL,2015-07-17,,2850.94,EURO,0,11792,30191400-8,DA7077427,Directia Impozite si Taxe Locale sector 5
,SEIF DEPOZIT PROMET DSC 67 ,"Sector 4, Bucharest, Romania",44.3755564,26.1217478,ROPECO BUCURESTI S.R.L.,2015-07-07,,2480.05,EURO,0,16098,44421000-7,DA7033463,Directia Impozite si Taxe Locale sector 5
,Bonuri valorice pentru carburanti auto,"Sector 4, Bucharest, Romania",44.3755564,26.1216478,OMV PETROM MARKETING S.R.L.,2015-09-24,,2184.72,EURO,0,11338,22458000-5,DA7318797,Directia Impozite si Taxe Locale sector 5
,Masini de numarat bancnote GLORY GFB 800 ,"Sector 4, Bucharest, Romania",44.3755564,26.1215478,ROPECO BUCURESTI S.R.L.,2015-07-09,,2140.47,EURO,0,11743,30132200-5,DA7045323,Directia Impozite si Taxe Locale sector 5
,Servicii de furnizare internet,"Bulevardul Alexandru Obregia, București, Romania",44.3821177,26.1154766,ROBISOL SRL,2015-07-08,,6828.83,EURO,0,18474,72400000-4,DA7041599,CENTRU CULTURAL SECTOR 6
,Servicii creatie si mentenanta website,"Bulevardul Alexandru Obregia, București, Romania",44.3821177,26.1155766,ROBISOL SRL,2015-07-08,,5289,EURO,0,18299,72212224-5,DA7041645,CENTRU CULTURAL SECTOR 6
,CONSERVA DE CARNE DE PORC IN SUC PROPRIU 300G,"Bucuresti-Sector 5, Bucuresti, Romania",44.3876579,26.071708,HAME  ROMANIA  SRL,2015-09-28,,2398,EURO,0,10504,15131000-5,DA7324580,U.M. 0575 Bucuresti - Directia Generala de Jandarmi a Municipiului Bucuresti
,CONSERVA DE CARNE DE PORC IN SUC PROPRIU 300G EO,"Bucuresti-Sector 5, Bucuresti, Romania",44.3876579,26.071608,HAME  ROMANIA  SRL,2015-08-31,,1947.58,EURO,0,10504,15131000-5,DA7223487,U.M. 0575 Bucuresti - Directia Generala de Jandarmi a Municipiului Bucuresti
,Curs - Expert accesare fonduri structurale si de coeziune europene,"Șoseaua Olteniței 37-39, București, Romania",44.396895,26.113823,MS EXPERTMOB SRL,2015-07-02,,6683.81,EURO,0,18947,80530000-8,DA7010963,Directia Generala de Impozite si Taxe Locale Sector 4
,Curs - Expert accesare fonduri structurale si de coeziune europene,"Șoseaua Olteniței 37-39, București, Romania",44.396895,26.113723,MS EXPERTMOB SRL,2015-07-02,,6236.73,EURO,0,18947,80530000-8,DA7010994,Directia Generala de Impozite si Taxe Locale Sector 4
,Curs - Expert accesare fonduri structurale si de coeziune europene,"Șoseaua Olteniței 37-39, București, Romania",44.396895,26.113623,MS EXPERTMOB SRL,2015-07-02,,4895.5,EURO,0,18947,80530000-8,DA7011021,Directia Generala de Impozite si Taxe Locale Sector 4
,Achizitionare curs de formare profesionala,"Șoseaua Olteniței 37-39, București, Romania",44.396895,26.113523,MS EXPERTMOB SRL,2015-08-27,,4001.44,EURO,0,18947,80530000-8,DA7211638,Directia Generala de Impozite si Taxe Locale Sector 4
,Achizitie curs de formare profesionala - Competente sociale si civice,"Șoseaua Olteniței 37-39, București, Romania",44.396795,26.113723,MS EXPERTMOB SRL,2015-09-03,,3998.83,EURO,0,18947,80530000-8,DA7239379,Directia Generala de Impozite si Taxe Locale Sector 4
,Achizitionare Cartus toner TK3130 ,"Șoseaua Olteniței 37-39, București, Romania",44.396795,26.113623,Fsystems Best Solutions SRL,2015-08-06,,2846.38,EURO,0,11727,30125100-2,DA7144538,Directia Generala de Impozite si Taxe Locale Sector 4
,Achizitionare Toner Q5949X negru ,"Șoseaua Olteniței 37-39, București, Romania",44.396795,26.113523,Fsystems Best Solutions SRL,2015-08-06,,2301.62,EURO,0,11727,30125100-2,DA7143789,Directia Generala de Impozite si Taxe Locale Sector 4
,Plasa gard bordurata,"Str. Pridvorului 24, București",44.400017,26.119219,TRADE EUROPE INTERNATIONAL SRL,2015-08-04,,4992.62,EURO,0,16055,44313200-9,DA7136727,Directia Administrare Parcuri si Zone Agrement sector.4
,Lucrari de  Reparatii loc de joaca  Bila  in Parcul  Lumea Copiilor  din Sector 4 ,"Str. Pridvorului 24, București, România",44.400017,26.118219,RUTAR CONSTRUCT S.R.L.,2015-08-17,,68383.79,EURO,0,16817,45236290-9,DA7167600,Directia Administrare Parcuri si Zone Agrement sector.4
,Teava rectangulara,"Str. Pridvorului 24, București",44.400117,26.119219,TRADE EUROPE INTERNATIONAL SRL,2015-08-04,,2951.8,EURO,0,15916,44163100-1,DA7136702,Directia Administrare Parcuri si Zone Agrement sector.4
,Costum salopeta din tercot de 245 gr,"Str. Pridvorului 24, București",44.400117,26.118219,HIGH Q PROD S.R.L.,2015-08-03,,2218.29,EURO,0,11006,18143000-3,DA7131830,Directia Administrare Parcuri si Zone Agrement sector.4
,Calculator electronic/statie de lucru i3/4,"Odăi, Bucharest, Romania",44.4013095,26.0509149,sc corsar online srl,2015-07-15,,8745.71,EURO,0,11966,30213300-8,DA7068084,Penitenciarul Bucuresti Rahova
,Componente sistem de detectie perimetrala ,"nr. 13-15, București, Romania",44.4073443,26.0668288,MICRO LOGIC S.R.L.,2015-07-03,,2384.88,EURO,0,13818,35120000-1,DA7023527,UM 02499 BUCURESTI
,Serv. de curatenie gen. prof. ptr supraf. oriz. si verticale,"Bd. Energeticienilor, 3, Bucuresti-Sector 3, Bucuresti, 32091, Romania",44.407877,26.142713,UNIVERSAL MED CLEANING,2015-09-01,,4916.75,EURO,0,19242,90910000-9,DA7221108,GRADINITA NR. 255 BUCURESTI
,Lucrari de reabilitare retea de stingere a incendiilor,"Vitan, Bucharest, Romania",44.4105082,26.1290597,TRADE EUROPE INTERNATIONAL SRL,2015-09-02,,96326.38,EURO,0,17090,45343200-5,DA7238994,Institutul National de Cercetare-Dezvoltare Chimico Farmaceutica-I.C.C.F. Bucuresti
,Lucrari de reabilitare a instalatiei de alimentare de gaze naturale,"Vitan, Bucharest, Romania",44.4105082,26.1291597,SAM PROIECT GRUP S.R.L.,2015-09-02,,82681.35,EURO,0,17082,45333000-0,DA7239335,Institutul National de Cercetare-Dezvoltare Chimico Farmaceutica-I.C.C.F. Bucuresti
, Serv. de curatenie gen. prof. ptr supraf. oriz. si verticale,"Aleea Perișoru 9, București, Romania",44.41189,26.180947,UNIVERSAL MED CLEANING,2015-09-02,,4506.81,EURO,0,19242,90910000-9,DA7232590,GRADINITA NR.160 BUCURESTI
,PACHET LICENTE,"Aleea Perișoru 9, București, Romania",44.41189,26.180847,SKY BIT CONSULTING SRL,2015-09-02,,3471.04,EURO,0,17168,48000000-8,DA7232615,GRADINITA NR.160 BUCURESTI
,"LENOVO E50 Tower,monit 20 ","Calea Vitan 6, București 031296, Romania",44.4156855,26.1316801,SC Helios Mod Impex SRL,2015-09-21,,13842.71,EURO,0,11750,30141200-1,DA7308740,Casa de Pensii a Municipiului Bucuresti
,Multifunctionala laser A3 monocrom cu fax Kyocera FS-M6525dn ,"Calea Vitan 6, București 031296, Romania",44.4156855,26.1317801,SC BUSINESS SOLUTION PROVIDER GROUP SRL,2015-08-11,,11516.75,EURO,0,11990,30232110-8,DA7162232,Casa de Pensii a Municipiului Bucuresti
,Hartie copiator A4 ARTIST,"Calea Vitan 6, București 031296, Romania",44.4156855,26.1318801,OFFICE PRO MEDIA S.R.L.,2015-07-14,,8387.6,EURO,0,11829,30192700-8,DA7060431,Casa de Pensii a Municipiului Bucuresti
,Multifunctionala laser monocrom A3 Kyocera FS-M6525,"Calea Vitan 6, București 031296, Romania",44.4157855,26.1316801,SC BUSINESS SOLUTION PROVIDER GROUP SRL,2015-08-11,,7457.04,EURO,0,11990,30232110-8,DA7162268,Casa de Pensii a Municipiului Bucuresti
,imprimanta Kyocera P2135dn,"Calea Vitan 6, București 031296, Romania",44.4157855,26.1317801,SC BUSINESS SOLUTION PROVIDER GROUP SRL,2015-09-16,,2188.03,EURO,0,11990,30232110-8,DA7289690,Casa de Pensii a Municipiului Bucuresti
,[05082015] Lucrari de reparatii curente si de renovare la Colegiul National Gheorghe Sincai,"Calea Șerban Vodă 167, București 040205, Romania",44.416361,26.101099,SUCCESS CONSTRUCT S.R.L.,2015-08-06,,75187.91,EURO,0,17161,45453000-7,DA7146666,COLEGIUL NATIONAL GHEORGHE SINCAI Bucuresti
, [20150831] Lucrari de reparatii curente si de renovare/reamenajare la Colegiul National  Gh Sincai ,"Calea Șerban Vodă 167, București 040205, Romania",44.416361,26.101199,SUCCESS CONSTRUCT S.R.L.,2015-09-01,,23895.71,EURO,0,17161,45453000-7,DA7233724,COLEGIUL NATIONAL GHEORGHE SINCAI Bucuresti
, [u-044] sistem audio,"Calea Șerban Vodă 167, București 040205, Romania",44.416461,26.101099,Uranius SRL,2015-09-01,,16323.59,EURO,0,12481,32321200-1,DA7222200,COLEGIUL NATIONAL GHEORGHE SINCAI Bucuresti
,Lucrari de reparatii curente si de renovare la Colegiul National Gheorghe Sincai,"Calea Șerban Vodă 167, București 040205, Romania",44.416461,26.101199,SUCCESS CONSTRUCT S.R.L.,2015-08-24,,13377.11,EURO,0,17161,45453000-7,DA7201316,COLEGIUL NATIONAL GHEORGHE SINCAI Bucuresti
, vestiar metalic,"Strada Logofătul Tăutu 47, Bucuresti Sectorul 3, Romania",44.419822,26.117358,AQUA QUEEN S.R.L.,2015-09-17,,5425.08,EURO,0,14680,39122100-4,DA7299988,Caminul Pentru Persoane Varstnice al Municipiului Bucuresti Nicolae Cajal
,scutec absorbant pentru adulti,"Strada Logofătul Tăutu 47, Bucuresti Sectorul 3, Romania",44.419822,26.117458,BELLA ROMANIA IMPEX S.R.L.,2015-08-11,,2719,EURO,0,13233,33751000-9,DA7156658,Caminul Pentru Persoane Varstnice al Municipiului Bucuresti Nicolae Cajal
,Servicii de consultanta in domeniul achizitiilor publice,"Strada Valea Ialomiței 1, București 061961, Romania",44.420863,26.019137,Fast Consulting & Training S.R.L.,2015-07-06,,2681.62,EURO,0,18792,79418000-7,DA7013780,DIRECTIA INVATAMANT SI TINERET SECTOR 4
,Servicii de consultanta in domeniul achizitiilor publice.,"Strada Valea Ialomiței 1, București 061961, Romania",44.420863,26.019237,Fast Consulting & Training S.R.L.,2015-08-04,,2722.63,EURO,0,18792,79418000-7,DA7127779,DIRECTIA INVATAMANT SI TINERET SECTOR 4
,"REP. FAT.PAV.ADM.,ANEXA TEHNICA SI ANEXA SOCIALA IM.IOR-conf caiet sarcini nr.180629/20.08.2015 ","Bulevardul Nerva Traian, București 031041, Romania",44.4214348,26.1167005,EURO CONSTRUCT INTERNATIONAL S.R.L.,2015-09-17,,87207.27,EURO,0,17153,45443000-4,DA7299020,UM 0466 BUCURESTI
,Refacere pista alergare conform caiet de sarcini 180626/20.08.2015 ,"Bulevardul Nerva Traian, București 031041, Romania",44.4214348,26.1166005,Urbanito City Concept SRL,2015-09-22,,31809.47,EURO,0,16810,45236114-2,DA7313859,UM 0466 BUCURESTI
, REPARATI INVELITOARE PAVILION ,"Bulevardul Nerva Traian, București 031041, Romania",44.4214348,26.1165005,DELTA TERMO CONSTRUCT 1999 S.R.L.,2015-09-23,,7699.31,EURO,0,16948,45261210-9,DA7322003,UM 0466 BUCURESTI
,REPARATII INVELITOARE PAVILION INTERVENTIE ,"Bulevardul Nerva Traian, București 031041, Romania",44.4214348,26.1164005,DELTA TERMO CONSTRUCT 1999 S.R.L.,2015-09-23,,4703.84,EURO,0,16947,45261200-6,DA7321982,UM 0466 BUCURESTI
, REVIZUIRE INVELITOARE DIN TABLA ,"Bulevardul Nerva Traian, București 031041, Romania",44.4214348,26.1163005,DELTA TERMO CONSTRUCT 1999 S.R.L.,2015-09-23,,2752.06,EURO,0,16947,45261200-6,DA7322013,UM 0466 BUCURESTI
,Saltele judo tatami grosime 4 cm tip puzzle 1x1 m,"Bulevardul Nerva Traian, București 031041, Romania",44.4215348,26.1166005,BUDO BEST S.R.L.,2015-09-08,,2731.56,EURO,0,14710,39143112-4,DA7251591,UM 0466 BUCURESTI
,ACUMULATOR PENTRU MOTOROLA MTP850 LI-ION 3.7V 1900MAH,"Bulevardul Nerva Traian, București 031041, Romania",44.4216348,26.1165005,SPRINTER 2000 S.A.,2015-09-16,,2443.72,EURO,0,12459,32230000-4,DA7292487,UM 0466 BUCURESTI
, Explozor NONEL ,"Bulevardul Nerva Traian, București 031041, Romania",44.4217348,26.1164005,S.C. NITRO NOBEL GROUP S.R.L.,2015-08-17,,2106.76,EURO,0,11632,24615000-8,DA7179525,UM 0466 BUCURESTI
, Spray bottles 50 ml,"Bulevardul Nerva Traian, București 031041, Romania",44.4214348,26.1163005,AMEX IMPORT EXPORT S.R.L.,2015-09-21,,2100.66,EURO,0,13248,33793000-5,DA7313509,UM 0466 BUCURESTI
,"Lucrari de reparatii acoperis, module arhiva si jgheaburi, la sediul Directiei Locale de EvidentaS6","Strada Obcina Mare 2, București 061593, Romania",44.4218322,26.0421413,COMET EXPRES INVEST SRL,2015-07-15,,11512.91,EURO,0,16964,45261910-6,DA7069964,Directia Locala de Evidenta a Persoanelor Sector 6
,Licenta Microsoft Office 2013,"Drumul Taberei 40, București 061391, Romania",44.4232647,26.0372576,CADET PROJECT,2015-07-01,,28040.68,EURO,0,17212,48310000-4,DA7014789,DIRECTIA DE IMPOZITE SI TAXE LOCALE SECTOR 6
,Imprimante multifunctionale,"Drumul Taberei 40, București 061391, Romania",44.4232647,26.0372576,SMART GLOBAL TRADE,2015-09-18,,7059.44,EURO,0,11990,30232110-8,DA7303452,DIRECTIA DE IMPOZITE SI TAXE LOCALE SECTOR 6
,Licenta antivirus Eset Nod 32,"Drumul Taberei 40, București 061391, Romania",44.4232647,26.0372576,CADET PROJECT,2015-07-01,,6795.58,EURO,0,17304,48761000-0,DA7014871,DIRECTIA DE IMPOZITE SI TAXE LOCALE SECTOR 6
,UPS Online HF LCD 10KVA ,"Drumul Taberei 40, București 061391, Romania",44.4232647,26.0372576,SMART GLOBAL TRADE,2015-09-22,,5460.22,EURO,0,12121,31154000-0,DA7315374,DIRECTIA DE IMPOZITE SI TAXE LOCALE SECTOR 6
,Modul de consultare a bazei de date-serviciu on-line de transfer incasari impozite si taxe locale ,"Drumul Taberei 40, București 061391, Romania",44.4232647,26.0372576,INTEGRISOFT SOLUTIONS S.R.L.,2015-08-21,,4013.6,EURO,0,17282,48611000-4,DA7191450,DIRECTIA DE IMPOZITE SI TAXE LOCALE SECTOR 6
,Statie de lucru ,"Drumul Taberei 40, București 061391, Romania",44.4232647,26.0372576,SMART GLOBAL TRADE,2015-07-02,,3155.42,EURO,0,11963,30213000-5,DA7015448,DIRECTIA DE IMPOZITE SI TAXE LOCALE SECTOR 6
,Aparat de aer conditionat 24000 BTU,"Drumul Taberei 40, București 061391, Romania",44.4232647,26.0372576,SMART GLOBAL TRADE,2015-09-17,,2350.87,EURO,0,15073,39717200-3,DA7296761,DIRECTIA DE IMPOZITE SI TAXE LOCALE SECTOR 6
, Statie de lucru AIO Theon cu WIn 7,"B-dul Libertăţii nr. 12A, sector 5, Bucureşti",44.424386,26.090635,PRO SYS S.R.L.,2015-08-24,,3422.12,EURO,0,11966,30213300-8,DA7197263,Administratia Nationala a Rezervelor de Stat si Probleme Speciale - Unitatea Teritoriala 515 Bucuresti
,Lucrari de reparatii drumuri si alei in incinta si refacere canalizare,"Strada Sfânta Ecaterina, București, Romania",44.424757,26.101302,ELEKTRO KENNER SRL,2015-07-27,,99518.19,EURO,0,16726,45233142-6,DA7107063,ADMINISTRATIA SPITALELOR SI SERVICIILOR MEDICALE BUCURESTI
,REEVALUAREA/EVALUARE ACTIVELOR CORPORALE FIXE CLADIRI -IMOBILE PRINCIPALE CU SPECIFIC MEDICAL,"Strada Sfânta Ecaterina, București, Romania",44.424757,26.101302,Marin C. Anca-Ioana PFA,2015-09-02,,19798.74,EURO,0,18793,79419000-4,DA7237068,ADMINISTRATIA SPITALELOR SI SERVICIILOR MEDICALE BUCURESTI
,Servicii de distributie a apei potabile pe perioada caniculei,"Strada Sfânta Ecaterina, București, Romania",44.424757,26.101302,SELROM TRADING COMPANY S.R.L.,2015-07-06,,18564,EURO,0,19370,98000000-3,DA7025526,ADMINISTRATIA SPITALELOR SI SERVICIILOR MEDICALE BUCURESTI
,servicii diverse de administrare si intretinere puncte de prim ajutor,"Strada Sfânta Ecaterina, București, Romania",44.424757,26.101302,STAR LUISSE TOTAL SERV SRL-D,2015-07-06,,13833.42,EURO,0,19385,98300000-6,DA7028170,ADMINISTRATIA SPITALELOR SI SERVICIILOR MEDICALE BUCURESTI
,SERVICII DE REPARARE SI INTRETINERE APARATURA MEDICALA,"Strada Sfânta Ecaterina, București, Romania",44.424757,26.101302,DAMIRO COMAT S.R.L.,2015-09-11,,10311.62,EURO,0,17524,50421000-2,DA7276550,ADMINISTRATIA SPITALELOR SI SERVICIILOR MEDICALE BUCURESTI
,Pahare unica folosinta,"Strada Sfânta Ecaterina, București, Romania",44.424757,26.101302,SELROM TRADING COMPANY S.R.L.,2015-07-06,,8121.36,EURO,0,14766,39221123-5,DA7025522,ADMINISTRATIA SPITALELOR SI SERVICIILOR MEDICALE BUCURESTI
,REEVALUAREA/EVALUARE ACTIVELOR CORPORALE FIXE SECUNDARE -ANEXE CU SPECIFIC MEDICAL SI SPITALICESC,"Strada Sfânta Ecaterina, București, Romania",44.424757,26.101302,Marin C. Anca-Ioana PFA,2015-09-02,,6031,EURO,0,18793,79419000-4,DA7236165,ADMINISTRATIA SPITALELOR SI SERVICIILOR MEDICALE BUCURESTI
,Servicii de transport marfa,"Strada Sfânta Ecaterina, București, Romania",44.424757,26.101302,AZERA TRADE S.R.L.,2015-09-21,,5428.52,EURO,0,17751,60180000-3,DA7310748,ADMINISTRATIA SPITALELOR SI SERVICIILOR MEDICALE BUCURESTI
,"SERVICII DE COLECTARE, CENTRALIZARE SI MONITORIZARE INDICATORI FINANCIARI","Strada Sfânta Ecaterina, București, Romania",44.424757,26.101302,V.I.E.W. Company,2015-07-02,,3356.83,EURO,0,18462,72314000-9,DA7019669,ADMINISTRATIA SPITALELOR SI SERVICIILOR MEDICALE BUCURESTI
, LUCRARI REPARATII CABLURI ELECTRICE,"Strada Sfânta Ecaterina, București, Romania",44.424757,26.101302,AEG INTERNATIONAL SERVICII SRL,2015-07-27,,2238.5,EURO,0,17018,45311000-0,DA7107581,ADMINISTRATIA SPITALELOR SI SERVICIILOR MEDICALE BUCURESTI
, INTOCMIRE DOCUMENTATIE SI OBTINERE AUTORIZATIE DE CONSTRUIRE,"Strada Sfânta Ecaterina, București, Romania",44.424757,26.101302,AEG INTERNATIONAL SERVICII SRL,2015-08-12,,2040.17,EURO,0,18143,71322000-1,DA7160695,ADMINISTRATIA SPITALELOR SI SERVICIILOR MEDICALE BUCURESTI
,furnizare banca,"ADP Parcaje Sector 6, Aleea Bistra 1, București, Romania",44.4259035,26.0484108,SC CROMA RBC GROUP,2015-09-02,,23352.36,EURO,0,14671,39113600-3,DA7230607,ADMINISTRATIA DOMENIULUI PUBLIC SI DEZVOLTARE URBANA SECTOR 6
,furnizare bordura,"ADP Parcaje Sector 6, Aleea Bistra 1, București, Romania",44.4259035,26.0484108,CONCRETE MATERIALS GROUP SRL,2015-09-03,,20306,EURO,0,15866,44114200-4,DA7237449,ADMINISTRATIA DOMENIULUI PUBLIC SI DEZVOLTARE URBANA SECTOR 6
,furnizare si montare dale de cauciuc,"ADP Parcaje Sector 6, Aleea Bistra 1, București, Romania",44.4259035,26.0484108,URBANITO CITY PLAY SRL,2015-09-29,,18559.62,EURO,0,13119,33682000-4,DA7345774,ADMINISTRATIA DOMENIULUI PUBLIC SI DEZVOLTARE URBANA SECTOR 6
,furnizare cos de gunoi,"ADP Parcaje Sector 6, Aleea Bistra 1, București, Romania",44.4259035,26.0484108,SC CROMA RBC GROUP,2015-09-02,,18050.14,EURO,0,13671,34928480-6,DA7230637,ADMINISTRATIA DOMENIULUI PUBLIC SI DEZVOLTARE URBANA SECTOR 6
,furnizare nisip de rau,"ADP Parcaje Sector 6, Aleea Bistra 1, București, Romania",44.4259035,26.0484108,DIPA SRL,2015-07-07,,14993.64,EURO,0,10329,14211100-4,DA7029539,ADMINISTRATIA DOMENIULUI PUBLIC SI DEZVOLTARE URBANA SECTOR 6
,servicii de dezinsectie,"ADP Parcaje Sector 6, Aleea Bistra 1, București, Romania",44.4259035,26.0484108,PRIMOSAL S.R.L.,2015-09-08,,13093.5,EURO,0,19261,90921000-9,DA7249994,ADMINISTRATIA DOMENIULUI PUBLIC SI DEZVOLTARE URBANA SECTOR 6
,furnizare cos de gunoi,"ADP Parcaje Sector 6, Aleea Bistra 1, București, Romania",44.4259035,26.0484108,SC CROMA RBC GROUP,2015-09-02,,11732.59,EURO,0,13671,34928480-6,DA7235560,ADMINISTRATIA DOMENIULUI PUBLIC SI DEZVOLTARE URBANA SECTOR 6
,furnizare si montare dale de cauciuc,"ADP Parcaje Sector 6, Aleea Bistra 1, București, Romania",44.4259035,26.0484108,URBANITO CITY PLAY SRL,2015-09-29,,8430.03,EURO,0,13119,33682000-4,DA7345741,ADMINISTRATIA DOMENIULUI PUBLIC SI DEZVOLTARE URBANA SECTOR 6
,furnizare pavele,"ADP Parcaje Sector 6, Aleea Bistra 1, București, Romania",44.4259035,26.0484108,CONCRETE MATERIALS GROUP SRL,2015-09-03,,7896.9,EURO,0,15869,44114250-9,DA7237401,ADMINISTRATIA DOMENIULUI PUBLIC SI DEZVOLTARE URBANA SECTOR 6
,furnizare si livrare filer,"ADP Parcaje Sector 6, Aleea Bistra 1, București, Romania",44.4259035,26.0484108,DRAGON OIL STAR S.R.L.,2015-09-25,,7634.54,EURO,0,16340,44921210-7,DA7335299,ADMINISTRATIA DOMENIULUI PUBLIC SI DEZVOLTARE URBANA SECTOR 6
,furnizare bluza de protectie tip geaca,"ADP Parcaje Sector 6, Aleea Bistra 1, București, Romania",44.4259035,26.0484108,GARDENIA SERV,2015-07-21,,7468.76,EURO,0,13817,35113490-0,DA7081242,ADMINISTRATIA DOMENIULUI PUBLIC SI DEZVOLTARE URBANA SECTOR 6
,furnizare seminte gazon,"ADP Parcaje Sector 6, Aleea Bistra 1, București, Romania",44.4259035,26.0484108,AGROCOSM CONSULT SRL,2015-09-24,,7351.8,EURO,0,10036,03117200-6,DA7327901,ADMINISTRATIA DOMENIULUI PUBLIC SI DEZVOLTARE URBANA SECTOR 6
,furnizare banca,"ADP Parcaje Sector 6, Aleea Bistra 1, București, Romania",44.4259035,26.0484108,SC CROMA RBC GROUP,2015-09-02,,6091.92,EURO,0,14671,39113600-3,DA7235528,ADMINISTRATIA DOMENIULUI PUBLIC SI DEZVOLTARE URBANA SECTOR 6
,furnizare pantalon cu pieptar,"ADP Parcaje Sector 6, Aleea Bistra 1, București, Romania",44.4259035,26.0484108,GARDENIA SERV,2015-07-21,,5975.02,EURO,0,13815,35113470-4,DA7081269,ADMINISTRATIA DOMENIULUI PUBLIC SI DEZVOLTARE URBANA SECTOR 6
,furnizare pietris de rau,"ADP Parcaje Sector 6, Aleea Bistra 1, București, Romania",44.4259035,26.0484108,DIPA SRL,2015-07-07,,4183.5,EURO,0,10333,14212120-7,DA7029505,ADMINISTRATIA DOMENIULUI PUBLIC SI DEZVOLTARE URBANA SECTOR 6
,furnizare pietris de rau,"ADP Parcaje Sector 6, Aleea Bistra 1, București, Romania",44.4259035,26.0484108,DIPA SRL,2015-07-07,,4183.5,EURO,0,10333,14212120-7,DA7029522,ADMINISTRATIA DOMENIULUI PUBLIC SI DEZVOLTARE URBANA SECTOR 6
,furnizare tricou,"ADP Parcaje Sector 6, Aleea Bistra 1, București, Romania",44.4259035,26.0484108,GARDENIA SERV,2015-07-21,,3983.36,EURO,0,11054,18331000-8,DA7081254,ADMINISTRATIA DOMENIULUI PUBLIC SI DEZVOLTARE URBANA SECTOR 6
,furnizare saci plastic,"ADP Parcaje Sector 6, Aleea Bistra 1, București, Romania",44.4259035,26.0484108,EXPERT DEZVOLTING S. R. L.,2015-09-02,,3927,EURO,0,11273,19640000-4,DA7229152,ADMINISTRATIA DOMENIULUI PUBLIC SI DEZVOLTARE URBANA SECTOR 6
,furnizare plasa bordurata,"ADP Parcaje Sector 6, Aleea Bistra 1, București, Romania",44.4259035,26.0484108,APROMA IMPEX SRL,2015-07-21,,3496.74,EURO,0,16053,44313000-7,DA7080509,ADMINISTRATIA DOMENIULUI PUBLIC SI DEZVOLTARE URBANA SECTOR 6
,furnizare plasa bordurata,"ADP Parcaje Sector 6, Aleea Bistra 1, București, Romania",44.4259035,26.0484108,APROMA IMPEX SRL,2015-07-21,,3451.48,EURO,0,16053,44313000-7,DA7080499,ADMINISTRATIA DOMENIULUI PUBLIC SI DEZVOLTARE URBANA SECTOR 6
,servicii de mentenanta calculatoare PC,"ADP Parcaje Sector 6, Aleea Bistra 1, București, Romania",44.4259035,26.0484108,SC KYO COMPUTERS SERVICE SRL,2015-07-29,,2808.27,EURO,0,17480,50322000-8,DA7110789,ADMINISTRATIA DOMENIULUI PUBLIC SI DEZVOLTARE URBANA SECTOR 6
,furnizare vopsea ,"ADP Parcaje Sector 6, Aleea Bistra 1, București, Romania",44.4259035,26.0484108,ROMTEHNOCHIM S.R.L.,2015-07-24,,2419.86,EURO,0,16306,44811000-8,DA7091316,ADMINISTRATIA DOMENIULUI PUBLIC SI DEZVOLTARE URBANA SECTOR 6
,furnizare vopsea ,"ADP Parcaje Sector 6, Aleea Bistra 1, București, Romania",44.4259035,26.0484108,ROMTEHNOCHIM S.R.L.,2015-09-17,,2418.6,EURO,0,16306,44811000-8,DA7284818,ADMINISTRATIA DOMENIULUI PUBLIC SI DEZVOLTARE URBANA SECTOR 6
,Serv. de curatenie gen. prof. ptr supraf. oriz. si verticale,"Str. Fildesului, 1A, Bucuresti-Sector 3, Bucuresti, 31651, Romania",44.4268545,26.1445272,UNIVERSAL MED CLEANING,2015-09-08,,4215.78,EURO,0,19242,90910000-9,DA7246501,GRADINITA NR. 240 BUCURESTI
,PACHET LICENTE,"Str. Fildesului, 1A, Bucuresti-Sector 3, Bucuresti, 31651, Romania",44.4268545,26.1445272,SKY BIT CONSULTING SRL,2015-09-08,,3760.8,EURO,0,17168,48000000-8,DA7246587,GRADINITA NR. 240 BUCURESTI
, Laptop,"Str. Fildesului, 1A, Bucuresti-Sector 3, Bucuresti, 31651, Romania",44.4268545,26.1445272,Euro Bit SA,2015-09-08,,3412.45,EURO,0,11964,30213100-6,DA7246573,GRADINITA NR. 240 BUCURESTI
,Ecran electric profesional cu telecomanda,"Str. Fildesului, 1A, Bucuresti-Sector 3, Bucuresti, 31651, Romania",44.4268545,26.1445272,Euro Bit SA,2015-09-08,,2589.95,EURO,0,12481,32321200-1,DA7246701,GRADINITA NR. 240 BUCURESTI
,Videoproiector,"Str. Fildesului, 1A, Bucuresti-Sector 3, Bucuresti, 31651, Romania",44.4268545,26.1445272,Euro Bit SA,2015-09-08,,2391.23,EURO,0,14604,38652120-7,DA7246662,GRADINITA NR. 240 BUCURESTI
,cutii de arhivare-model Archivit'',"Bulevardul Unirii 37, București 030823, Romania",44.4271028,26.110317,ARCHIVIT S.R.L.,2015-09-22,,4205.5,EURO,0,16272,44617100-9,DA7317152,TRIBUNALUL BUCURESTI
,SPUMA POLIURETANICA PENTRU TERMO-HIDROIZOLATII,"Bulevardul Unirii 37, București 030823, Romania",44.4271028,26.110317,HANNOVER  ENGINEERING S.R.L.,2015-09-24,,3392.5,EURO,0,15966,44192100-3,DA7325275,TRIBUNALUL BUCURESTI
,Achizitie servicii de evaluare mijloace fixe,"Piața Unirii, București, Romania",44.4278279,26.1038967,GCT EVAL SRL,2015-09-21,,30394.02,EURO,0,18152,71324000-5,DA7306424,Administratia Lacuri Parcuri si Agrement Bucuresti
,Achizitie echipament pentru sporturi nautice,"Piața Unirii, București, Romania",44.4278279,26.1038967,PRONAUTICA S.R.L.,2015-08-06,,14073,EURO,0,14121,37416000-7,DA7142017,Administratia Lacuri Parcuri si Agrement Bucuresti
,Achizitie lacuri si vopsele,"Piața Unirii, București, Romania",44.4278279,26.1038967,Beligi SRL,2015-08-05,,9536.57,EURO,0,16304,44800000-8,DA7137508,Administratia Lacuri Parcuri si Agrement Bucuresti
