,Bonuri valorice pentru carburanti auto,"Sos. Dudesti-Pantelimon, 3, Bucuresti-Sector 3, Bucuresti, Romania",44.43399,26.186504,OMV PETROM MARKETING S.R.L.,2015-08-17,,2290.32,EURO,0,11338,22458000-5,DA7171858,ADMINISTRATIA PIETELOR SECTOR 2
,Bonuri valorice pentru carburanti,"Sos. Dudesti-Pantelimon, 3, Bucuresti-Sector 3, Bucuresti, Romania",44.43399,26.186504,OMV PETROM MARKETING S.R.L.,2015-08-17,,2055.18,EURO,0,11338,22458000-5,DA7177745,ADMINISTRATIA PIETELOR SECTOR 2
,Servicii de intocmire relevee (imobil + instalatii),"Bulevardul Basarabia 37-39, București, Romania",44.4342248,26.1515264,Radu Mihai Sersescu Birou Individual de Arhitectura,2015-09-21,,8510.31,EURO,0,18095,71250000-5,DA7310541,"SCOALA NATIONALA DE SANATATE PUBLICA, MANAGEMENT SI PERFECTIONARE IN DOMENIUL SANITAR BUCURESTI"
,Servicii de dezvoltare aplicatie de colectare date DRG National2015,"Bulevardul Basarabia 37-39, București, Romania",44.4342248,26.1515264,IONESCU VLAD-ANDREI PERSOANA FIZICA AUTORIZATA,2015-08-26,,7660.42,EURO,0,18443,72262000-9,DA7210897,"SCOALA NATIONALA DE SANATATE PUBLICA, MANAGEMENT SI PERFECTIONARE IN DOMENIUL SANITAR BUCURESTI"
,Sistem electronic dirijare si ordonare ghisee,"Bulevardul Regina Elisabeta 29-31, București 50012, Romania",44.434659,26.096113,DIGITAL IT SOLUTIONS,2015-07-31,,11778.15,EURO,0,12372,31710000-6,DA7125301,Sector 5 (Primaria Sectorului 5 Bucuresti)
,Platforma ridicatoare pe plan inclinat,"Bulevardul Regina Elisabeta 29-31, București 50012, Romania",44.434659,26.096113,KONE Ascensorul S.A.,2015-07-31,,8963.16,EURO,0,16159,44481000-5,DA7125811,Sector 5 (Primaria Sectorului 5 Bucuresti)
,Kit instalare aparat aer conditionat cu 6 metri,"Bulevardul Regina Elisabeta 29-31, București 50012, Romania",44.434659,26.096113,ROVIO COLECTION S.R.L.,2015-07-03,,4531.72,EURO,0,15073,39717200-3,DA7017389,Sector 5 (Primaria Sectorului 5 Bucuresti)
,lucrari de vrenovare,"Bulevardul Regina Elisabeta 29-31, București 50012, Romania",44.434659,26.096113,SECURIT S.A.,2015-07-29,,4129.8,EURO,0,17162,45453100-8,DA7113241,Sector 5 (Primaria Sectorului 5 Bucuresti)
,FISET METALIC,"Bulevardul Regina Elisabeta 29-31, București 50012, Romania",44.434659,26.096113,SILVAROM S.A.,2015-07-29,,3995.02,EURO,0,14657,39100000-3,DA7116535,Sector 5 (Primaria Sectorului 5 Bucuresti)
,Kit instalare aparat aer conditionat ,"Bulevardul Regina Elisabeta 29-31, București 50012, Romania",44.434659,26.096113,ROVIO COLECTION S.R.L.,2015-07-03,,3806.42,EURO,0,15073,39717200-3,DA7017339,Sector 5 (Primaria Sectorului 5 Bucuresti)
,Lucrari de compartimentare ,"Bulevardul Regina Elisabeta 29-31, București 50012, Romania",44.434659,26.096113,SECURIT S.A.,2015-07-29,,3067.37,EURO,0,17109,45421141-4,DA7113202,Sector 5 (Primaria Sectorului 5 Bucuresti)
, Kit instalare aparat aer conditionat,"Bulevardul Regina Elisabeta 29-31, București 50012, Romania",44.434659,26.096113,ROVIO COLECTION S.R.L.,2015-07-03,,2940.58,EURO,0,15073,39717200-3,DA7017366,Sector 5 (Primaria Sectorului 5 Bucuresti)
,"Calculator Pro Office Intel i3, 250gb ssd, Windows 7 pro 64biti , monitor 21.5  LED","Bulevardul Regina Elisabeta 29-31, București 50012, Romania",44.434659,26.096113,DIGITAL IT SOLUTIONS,2015-07-06,,2860.4,EURO,0,11963,30213000-5,DA7022083,Sector 5 (Primaria Sectorului 5 Bucuresti)
,Aparat foto profesional Canon EOS 600D DSLR cu accesorii incluse,"Bulevardul Regina Elisabeta 29-31, București 50012, Romania",44.434659,26.096113,DIGITAL IT SOLUTIONS,2015-07-06,,2279.38,EURO,0,14600,38651600-9,DA7022071,Sector 5 (Primaria Sectorului 5 Bucuresti)
, Lucrari de arhitectura peisagistica,"Bulevardul Ion C. Brătianu 2, București, Romania",44.4348031,26.1022246,SPAZIO VERDE SISTEME DE IRIGATII S.R.L.,2015-07-13,,98794.33,EURO,0,16386,45112700-2,DA7050658,MUZEUL MUNICIPIULUI BUCURESTI
, LUCRARI DE RENOVARE A CLADIRILOR DEGRADATE,"Bulevardul Ion C. Brătianu 2, București, Romania",44.4348031,26.1022246,S.C. VALKONS DESIGN ART S.R.L.,2015-07-01,,64170.81,EURO,0,17011,45262690-4,DA7013513,MUZEUL MUNICIPIULUI BUCURESTI
, Lucrari de instalare de sisteme de iluminare si de semnalizare,"Bulevardul Ion C. Brătianu 2, București, Romania",44.4348031,26.1022246,SPAZIO VERDE SISTEME DE IRIGATII S.R.L.,2015-07-13,,36289.25,EURO,0,17048,45316000-5,DA7050645,MUZEUL MUNICIPIULUI BUCURESTI
, PAVARE,"Bulevardul Ion C. Brătianu 2, București, Romania",44.4348031,26.1022246,SPAZIO VERDE SISTEME DE IRIGATII S.R.L.,2015-07-13,,33560.99,EURO,0,17132,45432112-2,DA7050592,MUZEUL MUNICIPIULUI BUCURESTI
, Servicii de intretinere instalatii de incalzire,"Bulevardul Ion C. Brătianu 2, București, Romania",44.4348031,26.1022246,SC LAZAR INSTALCON SRL,2015-07-14,,6184.78,EURO,0,16942,45259300-0,DA7050708,MUZEUL MUNICIPIULUI BUCURESTI
,Lucrari de constructii canal - scurgere,"Bulevardul Ion C. Brătianu 2, București, Romania",44.4348031,26.1022246,SC LAZAR INSTALCON SRL,2015-07-14,,4522.76,EURO,0,16704,45232453-2,DA7050746,MUZEUL MUNICIPIULUI BUCURESTI
,Lucrari de istalare de gaze,"Bulevardul Ion C. Brătianu 2, București, Romania",44.4348031,26.1022246,SC LAZAR INSTALCON SRL,2015-07-14,,4464.29,EURO,0,17082,45333000-0,DA7050731,MUZEUL MUNICIPIULUI BUCURESTI
, BILETE MUZEU 5 MODELE,"Bulevardul Ion C. Brătianu 2, București, Romania",44.4348031,26.1022246,OSCAR PRINT S.R.L.,2015-07-24,,4190,EURO,0,18845,79800000-2,DA7095858,MUZEUL MUNICIPIULUI BUCURESTI
, IRIGATII,"Bulevardul Ion C. Brătianu 2, București, Romania",44.4348031,26.1022246,SPAZIO VERDE SISTEME DE IRIGATII S.R.L.,2015-07-13,,3785.29,EURO,0,16667,45232120-9,DA7050615,MUZEUL MUNICIPIULUI BUCURESTI
, BILETE MUZEU 4 MODELE,"Bulevardul Ion C. Brătianu 2, București, Romania",44.4348031,26.1022246,OSCAR PRINT S.R.L.,2015-07-24,,2897.6,EURO,0,18845,79800000-2,DA7095866,MUZEUL MUNICIPIULUI BUCURESTI
,] Dell Optiplex 790,"Bulevardul Ion C. Brătianu 2, București, Romania",44.4348031,26.1022246,A.T.C. SOLUTIONS IMPEX S.R.L.,2015-08-31,,2250.13,EURO,0,11966,30213300-8,DA7223756,MUZEUL MUNICIPIULUI BUCURESTI
,Servicii curatenie zilnica de intretinere ,"Strada Scaune 1-3, București 030243, Romania",44.43515,26.105047,SC EXPERT CLEANING & CONSULTING SRL,2015-08-27,,4157.75,EURO,0,19242,90910000-9,DA7217373,PARCHETUL DE PE LANGA TRIBUNALUL BUCURESTI
,Lucrari de raschetare si paluxare parchet,"Strada Scaune 1-3, București 030243, Romania",44.43515,26.105047,MM PRODCOM '56 S.R.L.,2015-08-07,,4177.29,EURO,0,17152,45442300-0,DA7151468,PARCHETUL DE PE LANGA TRIBUNALUL BUCURESTI
,LUCRARI DE VOPSITORIE CU VOPSEA LAVABILA ,"Strada Scaune 1-3, București 030243, Romania",44.43515,26.105047,MM PRODCOM '56 S.R.L.,2015-08-17,,2667.72,EURO,0,17144,45442100-8,DA7178312,PARCHETUL DE PE LANGA TRIBUNALUL BUCURESTI
,HP LaserJet Enterprise M606dn ,"Strada Scaune 1-3, București 030243, Romania",44.43515,26.105047,COSMIC PRINTER EXPERT S.R.L.,2015-08-07,,2297.6,EURO,0,11990,30232110-8,DA7153119,PARCHETUL DE PE LANGA CURTEA DE APEL BUCURESTI
, Lucrari de vopsitorie cu vopsea lavabila inclusiv reparatii partiale la cladire,"Strada Scaune 1-3, București 030243, Romania",44.43515,26.105047,MM PRODCOM '56 S.R.L.,2015-09-24,,2008.08,EURO,0,17144,45442100-8,DA7333705,PARCHETUL DE PE LANGA TRIBUNALUL BUCURESTI
,cadita dus 80/80,"Bulevardul Regina Elisabeta 4-12, București 030018, Romania",44.4352766,26.1007958,FINANCIAL SERVICES STOP GROUP SRL,2015-07-08,,10705.19,EURO,0,16085,44411000-4,DA7039106,Universitatea din Bucuresti
,Licenta IBM SPSS Statistics Standard Authorized User License + SW Subscription & Support 12 Months,"Str. Patrascanu Lucretiu, 16, Bucuresti-Sector 3, Bucuresti, 030508, Romania",44.4360642,26.1702765,SC Q'NET INTERNATIONAL SRL,2015-08-27,,4907.38,EURO,0,17260,48463000-1,DA7215900,Institutul National de Cercetare-Dezvoltare pentru Textile si Pielarie Bucuresti
,"Licentiere Stata 14 - Special Edition (SE) single user, perpetual, Gov","Str. Patrascanu Lucretiu, 16, Bucuresti-Sector 3, Bucuresti, 030508, Romania",44.4360642,26.1702765,SC Q'NET INTERNATIONAL SRL,2015-08-27,,2488.5,EURO,0,17260,48463000-1,DA7216078,Institutul National de Cercetare-Dezvoltare pentru Textile si Pielarie Bucuresti
,"Hartie alba pentru copiator A4, 80g/mp, 500coli/top, clasa A, Double A","Bulevardul Carol I nr 34 – 36, etaj 7, sector 2, cod postal 020922, Bucuresti",44.436707,26.109514,VECTOR INTERNATIONAL S.R.L.,2015-09-03,,4174.5,EURO,0,11907,30197642-8,DA7242672,Organism Intermediar Regional pentru Programul Operational Sectorial pentru Dezvoltarea Resurselor Umane Bucuresti Ilfov
,Kit Imaging Unit pentru multifunctionala Lexmark x940e,"Bulevardul Carol I nr 34 – 36, etaj 7, sector 2, cod postal 020922, Bucuresti",44.436707,26.109514,BIROTECH S.R.L.,2015-09-08,,2561.96,EURO,0,11729,30125120-8,DA7255402,Organism Intermediar Regional pentru Programul Operational Sectorial pentru Dezvoltarea Resurselor Umane Bucuresti Ilfov
,Proiector profil Niethammer HPZ 2511D,"Bulevardul Nicolae Bălcescu 2, București 010051, Romania",44.4377828,26.1011918,MEGAVISION PROFESSIONAL SRL,2015-08-06,,28736.15,EURO,0,12265,31518600-6,DA7148923,Teatrul National I.L. Caragiale Bucuresti
,"Sistem rack dimmeri 48x3,7 kVA si booster DMX MA Lighting","Bulevardul Nicolae Bălcescu 2, București 010051, Romania",44.4377828,26.1011918,MEGAVISION PROFESSIONAL SRL,2015-08-06,,13051.57,EURO,0,15602,42961000-0,DA7148933,Teatrul National I.L. Caragiale Bucuresti
,Incinta acustica DYNACORD VL212 800 W,"Bulevardul Nicolae Bălcescu 2, București 010051, Romania",44.4377828,26.1011918,GEROM INTERNATIONAL PRODIMEX S.R.L.,2015-08-06,,6531.28,EURO,0,12523,32342412-3,DA7147641,Teatrul National I.L. Caragiale Bucuresti
,Lenovo 59432219 Y5070 Core i7 CPU i7-4710HQ 2500 MHz,"Bulevardul Nicolae Bălcescu 2, București 010051, Romania",44.4377828,26.1011918,ATEX COMPUTER S.R.L.,2015-07-07,,4633.31,EURO,0,11964,30213100-6,DA7036858,Teatrul National I.L. Caragiale Bucuresti
,MacBook Pro 15  Retina/Quad-core i7 2.5GHz/16GB/512GB SSD/Radeon M370X 2GB/INT KB,"Bulevardul Nicolae Bălcescu 2, București 010051, Romania",44.4377828,26.1011918,ATEX COMPUTER S.R.L.,2015-07-07,,4421.15,EURO,0,11964,30213100-6,DA7036881,Teatrul National I.L. Caragiale Bucuresti
,Videoproiector Business Epson EB-1985WU,"Bulevardul Nicolae Bălcescu 2, București 010051, Romania",44.4377828,26.1011918,Evolution Prest Systems S.R.L.,2015-07-08,,3008.76,EURO,0,14604,38652120-7,DA7040322,Teatrul National I.L. Caragiale Bucuresti
,ECRAN PROIECTIE RAMA FIXA 400X225CM,"Bulevardul Nicolae Bălcescu 2, București 010051, Romania",44.4377828,26.1011918,Intend Computer S.R.L.,2015-07-08,,2675.74,EURO,0,14613,38653400-1,DA7039280,Teatrul National I.L. Caragiale Bucuresti
,Videoproiector Epson EB-W28,"Bulevardul Nicolae Bălcescu 2, București 010051, Romania",44.4377828,26.1011918,Evolution Prest Systems S.R.L.,2015-07-08,,2266.56,EURO,0,14604,38652120-7,DA7040845,Teatrul National I.L. Caragiale Bucuresti
," Set microfon vocal de mana, EW 100-945 G3 - B	","Bulevardul Nicolae Bălcescu 2, București 010051, Romania",44.4377828,26.1011918,DB TECHNOLIGHT S.R.L.,2015-08-06,,2171.28,EURO,0,12515,32341000-5,DA7148180,Teatrul National I.L. Caragiale Bucuresti
,Incinta acustica subwoofer SUB18 DYNACORD 700 W,"Bulevardul Nicolae Bălcescu 2, București 010051, Romania",44.4377828,26.1011918,GEROM INTERNATIONAL PRODIMEX S.R.L.,2015-08-06,,2155.98,EURO,0,12523,32342412-3,DA7147663,Teatrul National I.L. Caragiale Bucuresti
,BROSURA LIMBA ENGLEZA,"Bulevardul Nicolae Bălcescu 2, București 010051, Romania",44.4377828,26.1011918,MYCAR GLOBAL TRADING S.R.L.,2015-08-11,,2094.4,EURO,0,11286,22100000-1,DA7159060,Teatrul National I.L. Caragiale Bucuresti
,Furnizare hartie copiator A4 top 500 Referat nr. E15605/21.07.2015 DGRFPB,"Strada Doctor Dimitrie D. Gerota 13, București, Romania",44.437825,26.105391,LIBRA OFFICE IND. SRL,2015-08-03,,10978.41,EURO,0,11907,30197642-8,DA7128126,DIRECTIA GENERALA REGIONALA A FINANTELOR PUBLICE BUCURESTI
,"Servicii inchiriere spatiu de depozitare, conform referat E 16764 / 31.08.2015","Strada Doctor Dimitrie D. Gerota 13, București, Romania",44.437825,26.105391,AUTO CAR & TRUCKS TECHNOLOGY S.R.L.,2015-09-01,,10012.25,EURO,0,18040,70000000-1,DA7228564,DIRECTIA GENERALA REGIONALA A FINANTELOR PUBLICE BUCURESTI
,"Hartie copiator A4, Sky Copy, 80gr. 500coli/top Referat nr. 70413/22.07.2015 ATCPMB","Strada Doctor Dimitrie D. Gerota 13, București, Romania",44.437825,26.105391,TROPEVM S.R.L.,2015-08-12,,6279.49,EURO,0,11913,30199000-0,DA7165132,DIRECTIA GENERALA REGIONALA A FINANTELOR PUBLICE BUCURESTI
,CUTIE CARTON -Ref.nr.431906/29.06.2015-AS1FP ,"Strada Doctor Dimitrie D. Gerota 13, București, Romania",44.437825,26.105391,ANDERA TRADING S.R.L.,2015-07-01,,4412.4,EURO,0,16272,44617100-9,DA7014549,DIRECTIA GENERALA REGIONALA A FINANTELOR PUBLICE BUCURESTI
,Referat 16834/02.08.2015/ Serv manipulare Bunuri,"Strada Doctor Dimitrie D. Gerota 13, București, Romania",44.437825,26.105391,CDM PRESTARI SERVICII SRL,2015-09-07,,2346.5,EURO,0,17795,63100000-0,DA7239249,DIRECTIA GENERALA REGIONALA A FINANTELOR PUBLICE BUCURESTI
, Dispozitive de stocare cu memorie flash,"Șoseaua Mihai Bravu 137, București, Romania",44.438571,26.13577,ELECTRON AD,2015-09-01,,6768.8,EURO,0,12013,30233180-6,DA7233759,Politia Locala Sector 2
,HDD WD NAS 4TB.,"Șoseaua Mihai Bravu 137, București, Romania",44.438571,26.13577,ELECTRON AD,2015-09-30,,3389.98,EURO,0,12003,30233132-5,DA7364477,Politia Locala Sector 2
,PANTALONI DE SERVICIU DIN TERCOT BLEOMAREN BARBATI SI FETE,"Șoseaua Mihai Bravu 137, București, Romania",44.438571,26.13577,MONICA DESIGN IMPEX S.R.L.,2015-09-29,,3257.58,EURO,0,11028,18234000-8,DA7357092,Politia Locala Sector 2
,INSTALATIE OPTIMIZARE COMBUSTIE UCCE V 2.0,"Șoseaua Mihai Bravu 137, București, Romania",44.438571,26.13577,IDEEA ZONE SRL,2015-09-24,,2748.43,EURO,0,13431,34300000-0,DA7324915,Politia Locala Sector 2
,"Servicii de inchiriere,mentenanta si asistenta tehnica sistem financiar-contabil SNI Manager","Șoseaua Mihai Bravu 137, București, Romania",44.438571,26.13577,SOCIETATEA NATIONALA DE INFORMATICA S.A.,2015-09-23,,2496.89,EURO,0,18442,72261000-2,DA7327328,Politia Locala Sector 2
,PULOVER DE CULOARE  NEGRU ,"Șoseaua Mihai Bravu 137, București, Romania",44.438571,26.13577,MONICA DESIGN IMPEX S.R.L.,2015-09-29,,2198.15,EURO,0,11024,18230000-0,DA7357246,Politia Locala Sector 2
,"Perna super-bawl, antiacarieni, lavabila, dim.: 50x70cm","Splaiul Independenței 169, București 050098, Romania",44.4385923,26.0691479,NETPROSPER S.R.L.,2015-08-25,,6754.9,EURO,0,14935,39516120-9,DA7202307,SPITALUL UNIVERSITAR DE URGENTA BUCURESTI
,Filtru diasafe plus,"Splaiul Independenței 169, București 050098, Romania",44.4385923,26.0691479,FRESENIUS MEDICAL CARE ROMANIA S.R.L.,2015-08-31,,5135.21,EURO,0,12929,33181200-4,DA7225627,SPITALUL UNIVERSITAR DE URGENTA BUCURESTI
,Meropenem,"Splaiul Independenței 169, București 050098, Romania",44.4385923,26.0691479,POLISANO S.R.L.,2015-08-07,,4624.06,EURO,0,13121,33690000-3,DA7148855,SPITALUL UNIVERSITAR DE URGENTA BUCURESTI
,sac cadavre,"Splaiul Independenței 169, București 050098, Romania",44.4385923,26.0691479,PROSAPIA S.R.L.,2015-07-20,,4598.94,EURO,0,13267,33922000-9,DA7080150,SPITALUL UNIVERSITAR DE URGENTA BUCURESTI
,"3642539] METRONIDAZOL 500 mg, flacon polietilena 100 ml 3642539","Splaiul Independenței 169, București 050098, Romania",44.4385923,26.0691479,B.BRAUN MEDICAL S.R.L.,2015-07-17,,3403.2,EURO,0,13131,33692400-1,DA7076702,SPITALUL UNIVERSITAR DE URGENTA BUCURESTI
,Actilyse 50mg x 1fl liof sol inj + 1fl solv,"Splaiul Independenței 169, București 050098, Romania",44.4385923,26.0691479,EUROPHARM HOLDING S.A.,2015-08-25,,3323.43,EURO,0,13027,33600000-6,DA7204842,SPITALUL UNIVERSITAR DE URGENTA BUCURESTI
,CARBOPLATIN ACTAVIS 10MG/ML (CARBOPLATINUM) FL.450 MG.,"Splaiul Independenței 169, București 050098, Romania",44.4385923,26.0691479,ACTAVIS S.R.L.,2015-07-17,,2828.31,EURO,0,13133,33692510-5,DA7078506,SPITALUL UNIVERSITAR DE URGENTA BUCURESTI
, IRINOTESIN 20MG/ML 5mg/ml 100mg (IRINOTECANUM),"Splaiul Independenței 169, București 050098, Romania",44.4385923,26.0691479,ACTAVIS S.R.L.,2015-08-17,,2393.27,EURO,0,13099,33652100-6,DA7177360,SPITALUL UNIVERSITAR DE URGENTA BUCURESTI
,Dantrolene sodic,"Splaiul Independenței 169, București 050098, Romania",44.4385923,26.0691479,DYNAMIC MEDICAL SOLUTIONS SRL,2015-08-07,,2266.7,EURO,0,13132,33692500-2,DA7148846,SPITALUL UNIVERSITAR DE URGENTA BUCURESTI
,"Seringa de 100 ml din trei parti fara ac, pentru irigatie/alimentatie enterala - OMNIFIX 100 ml ","Splaiul Independenței 169, București 050098, Romania",44.4385923,26.0691479,B.BRAUN MEDICAL S.R.L.,2015-08-25,,2251.6,EURO,0,12811,33141310-6,DA7201300,SPITALUL UNIVERSITAR DE URGENTA BUCURESTI
,Vancomicina 500 mg,"Splaiul Independenței 169, București 050098, Romania",44.4385923,26.0691479,FRESENIUS KABI ROMANIA S.R.L.,2015-08-07,,2224.75,EURO,0,13080,33651000-8,DA7148866,SPITALUL UNIVERSITAR DE URGENTA BUCURESTI
, IRINOTECANUM IRINOTESIN 20mg/ml 15 mg/ml 300 mg,"Splaiul Independenței 169, București 050098, Romania",44.4385923,26.0691479,ACTAVIS S.R.L.,2015-09-22,,2209.25,EURO,0,13075,33642000-2,DA7315753,SPITALUL UNIVERSITAR DE URGENTA BUCURESTI
,"Test Rapid Sumar de Urina, compatibil cu aparatul URIT-30 ","Splaiul Independenței 169, București 050098, Romania",44.4385923,26.0691479,PRIME HEALTHCARE S.R.L.,2015-09-02,,2030.64,EURO,0,12932,33181500-7,DA7236796,SPITALUL UNIVERSITAR DE URGENTA BUCURESTI
,Piperacilina + tazobactam 4.5 gr,"Splaiul Independenței 169, București 050098, Romania",44.4385923,26.0691479,FRESENIUS KABI ROMANIA S.R.L.,2015-08-05,,2018.91,EURO,0,13081,33651100-9,DA7140573,SPITALUL UNIVERSITAR DE URGENTA BUCURESTI
,Servicii de audit energetic ,"Strada Cernișoara 38, București 061019, Romania",44.438678,26.022647,AEDILLIA CONSTRUCT 90 SRL,2015-07-22,,28251.91,EURO,0,18120,71314300-5,DA7086208,DIRECTIA GENERALA DE ASISTENTA SOCIALA A MUNICIPIULUI BUCURESTI
,OUA ,"Strada Cernișoara 38, București 061019, Romania",44.438678,26.022647,CATTANI IMPEX S.R.L.,2015-08-31,,27720,EURO,0,10056,03142500-3,DA7218291,DIRECTIA GENERALA DE ASISTENTA SOCIALA A MUNICIPIULUI BUCURESTI
,Orez cu bobul lung ,"Strada Cernișoara 38, București 061019, Romania",44.438678,26.022647,CORADO PRODIMPEX S.R.L.,2015-08-31,,23368.2,EURO,0,10066,03211300-6,DA7218195,DIRECTIA GENERALA DE ASISTENTA SOCIALA A MUNICIPIULUI BUCURESTI
,Malai ,"Strada Cernișoara 38, București 061019, Romania",44.438678,26.022647,CORADO PRODIMPEX S.R.L.,2015-08-31,,11402.6,EURO,0,10734,15612210-6,DA7218248,DIRECTIA GENERALA DE ASISTENTA SOCIALA A MUNICIPIULUI BUCURESTI
,Faina ,"Strada Cernișoara 38, București 061019, Romania",44.438678,26.022647,CORADO PRODIMPEX S.R.L.,2015-08-31,,10659,EURO,0,10727,15612100-2,DA7218215,DIRECTIA GENERALA DE ASISTENTA SOCIALA A MUNICIPIULUI BUCURESTI
,Gris ,"Strada Cernișoara 38, București 061019, Romania",44.438678,26.022647,CORADO PRODIMPEX S.R.L.,2015-08-31,,2759.75,EURO,0,10767,15625000-5,DA7218272,DIRECTIA GENERALA DE ASISTENTA SOCIALA A MUNICIPIULUI BUCURESTI
,pat copil cu grilaj din lemn,"Strada Olari 11-13, București 021503, Romania",44.439008,26.116658,MOBILEC TRUST SRL,2015-07-14,,20698.52,EURO,0,14714,39143116-2,DA7056225,Directia Generala de Asistenta Sociala si Protectia Copilului Sector 2
,Pat copil cu grilaj de lemn ,"Strada Olari 11-13, București 021503, Romania",44.439008,26.116658,MOBILEC TRUST SRL,2015-08-03,,6193.99,EURO,0,14714,39143116-2,DA7125391,Directia Generala de Asistenta Sociala si Protectia Copilului Sector 2
,Jaluzele verticale,"Strada Olari 11-13, București 021503, Romania",44.439008,26.116658,MOBILEC TRUST SRL,2015-08-13,,4915.53,EURO,0,14931,39515440-1,DA7165609,Directia Generala de Asistenta Sociala si Protectia Copilului Sector 2
,Masute plastic cu picioare metalice ,"Strada Olari 11-13, București 021503, Romania",44.439008,26.116658,MOBILEC TRUST SRL,2015-08-17,,4884.23,EURO,0,14678,39121200-8,DA7177256,Directia Generala de Asistenta Sociala si Protectia Copilului Sector 2
,scaune plastic,"Strada Olari 11-13, București 021503, Romania",44.439008,26.116658,MOBILEC TRUST SRL,2015-08-17,,4081.49,EURO,0,14664,39112100-1,DA7176761,Directia Generala de Asistenta Sociala si Protectia Copilului Sector 2
,Saltea spuma poliuretanica cu husa suplimentara detasabila impermeabila 1200X600X100,"Strada Olari 11-13, București 021503, Romania",44.439008,26.116658,MOBILEC TRUST SRL,2015-08-11,,3400.28,EURO,0,14710,39143112-4,DA7157981,Directia Generala de Asistenta Sociala si Protectia Copilului Sector 2
, Masina de spalat frontala ,"Strada Olari 11-13, București 021503, Romania",44.439008,26.116658,ALTEX ROMANIA S.R.L.,2015-09-28,,2872.83,EURO,0,15512,42716120-5,DA7347076,Directia Generala de Asistenta Sociala si Protectia Copilului Sector 2
,CORP BIBLIOTECA 3 USI SI 2 SERTARE,"Strada Olari 11-13, București 021503, Romania",44.439008,26.116658,MOBILEC TRUST SRL,2015-08-07,,2499.04,EURO,0,14681,39122200-5,DA7148145,Directia Generala de Asistenta Sociala si Protectia Copilului Sector 2
,Canapea cu sezut rabatabil si lada pentru depozitare,"Strada Olari 11-13, București 021503, Romania",44.439008,26.116658,MOBILEC TRUST SRL,2015-08-04,,2474.97,EURO,0,14667,39113200-9,DA7135601,Directia Generala de Asistenta Sociala si Protectia Copilului Sector 2
,PAT COPIL CU GRILAJ DE LEMN,"Strada Olari 11-13, București 021503, Romania",44.439008,26.116658,MOBILEC TRUST SRL,2015-08-05,,2315.24,EURO,0,14709,39143111-7,DA7141983,Directia Generala de Asistenta Sociala si Protectia Copilului Sector 2
,CORP BIBLIOTECA 3 USI,"Strada Olari 11-13, București 021503, Romania",44.439008,26.116658,MOBILEC TRUST SRL,2015-08-07,,2274.63,EURO,0,14681,39122200-5,DA7148179,Directia Generala de Asistenta Sociala si Protectia Copilului Sector 2
,CORP BIBLIOTECA 3 USI,"Strada Olari 11-13, București 021503, Romania",44.439008,26.116658,MOBILEC TRUST SRL,2015-08-07,,2244.03,EURO,0,14681,39122200-5,DA7147928,Directia Generala de Asistenta Sociala si Protectia Copilului Sector 2
,"Televizor LED Full HD, 23.6 , LG 24MT46D, negru","Strada Olari 11-13, București 021503, Romania",44.439008,26.116658,ALTEX ROMANIA S.R.L.,2015-09-17,,2050.54,EURO,0,12498,32330000-5,DA7296841,Directia Generala de Asistenta Sociala si Protectia Copilului Sector 2
,Autoturism,"Strada Batiștei 14, București 020937, Romania",44.439218,26.105335,RENAULT COMMERCIAL ROUMANIE S.R.L.,2015-09-28,,14569.56,EURO,0,13319,34110000-1,DA7343830,CENTRUL DE PROIECTE CULTURALE AL MUNICIPIULUI BUCURESTI - ARCUB
,Paza materiale pre/post eveniment,"Strada Batiștei 14, București 020937, Romania",44.439218,26.105335,BGS DIVIZIA DE SECURITATE S.R.L.,2015-09-01,,6877.05,EURO,0,18835,79713000-5,DA7233164,CENTRUL DE PROIECTE CULTURALE AL MUNICIPIULUI BUCURESTI - ARCUB
,CABINA TONOMAT DE POEZIE,"Strada Batiștei 14, București 020937, Romania",44.439218,26.105335,TOP EVENT SRL,2015-09-17,,2983.79,EURO,0,14266,37500000-3,DA7284889,CENTRUL DE PROIECTE CULTURALE AL MUNICIPIULUI BUCURESTI - ARCUB
,Wireless,"Strada Batiștei 14, București 020937, Romania",44.439218,26.105335,PCZONE ONLINE DISTRIBUTIE S.R.L.,2015-09-28,,2957.55,EURO,0,12575,32413100-2,DA7343129,CENTRUL DE PROIECTE CULTURALE AL MUNICIPIULUI BUCURESTI - ARCUB
, Paza materiale pre/post eveniment,"Strada Batiștei 14, București 020937, Romania",44.439218,26.105335,BGS DIVIZIA DE SECURITATE S.R.L.,2015-09-10,,2747.02,EURO,0,18835,79713000-5,DA7267075,CENTRUL DE PROIECTE CULTURALE AL MUNICIPIULUI BUCURESTI - ARCUB
,"Scaun din plastic cu perforatii, pentru Festivalul George Enescu","Strada Batiștei 14, București 020937, Romania",44.439218,26.105335,ULTRA PROCONFORT S.R.L.,2015-08-26,,2714.95,EURO,0,14663,39112000-0,DA7213406,CENTRUL DE PROIECTE CULTURALE AL MUNICIPIULUI BUCURESTI - ARCUB
,Paza materiale pre/post eveniment,"Strada Batiștei 14, București 020937, Romania",44.439218,26.105335,BGS DIVIZIA DE SECURITATE S.R.L.,2015-08-28,,2483.69,EURO,0,18835,79713000-5,DA7223038,CENTRUL DE PROIECTE CULTURALE AL MUNICIPIULUI BUCURESTI - ARCUB
,Paza materiale pre/post eveniment,"Strada Batiștei 14, București 020937, Romania",44.439218,26.105335,BGS DIVIZIA DE SECURITATE S.R.L.,2015-09-10,,2214.99,EURO,0,18835,79713000-5,DA7267111,CENTRUL DE PROIECTE CULTURALE AL MUNICIPIULUI BUCURESTI - ARCUB
,MOBILE RPW SHOCKWAVE ,"Strada Cernișoara 38, București 061019, Romania",44.439322,26.02298,SC ROMLAB SRL,2015-09-24,,18665.16,EURO,0,13022,33197000-7,DA7326012,DIRECTIA GENERALA DE ASISTENTA SOCIALA SI PROTECTIA COPILULUI SECTOR 6
,Licenta Microsoft - Microsoft Office Standard 2013 ,"Strada Cernișoara 38, București 061019, Romania",44.439322,26.02298,SC Ymens Teamnet SRL,2015-08-28,,16293.26,EURO,0,17221,48317000-3,DA7222344,DIRECTIA GENERALA DE ASISTENTA SOCIALA SI PROTECTIA COPILULUI SECTOR 6
,WINBACK 3 PROFESSIONAL ,"Strada Cernișoara 38, București 061019, Romania",44.439322,26.02298,SC ROMLAB SRL,2015-09-24,,14233.29,EURO,0,12891,33158200-4,DA7325743,DIRECTIA GENERALA DE ASISTENTA SOCIALA SI PROTECTIA COPILULUI SECTOR 6
,Sistem PC Desktop ,"Strada Cernișoara 38, București 061019, Romania",44.439322,26.02298,Wintech Electronic S.R.L.,2015-09-04,,9093.99,EURO,0,11954,30210000-4,DA7247572,DIRECTIA GENERALA DE ASISTENTA SOCIALA SI PROTECTIA COPILULUI SECTOR 6
,ICE CT 1000 ,"Strada Cernișoara 38, București 061019, Romania",44.439322,26.02298,SC ROMLAB SRL,2015-09-24,,8842.25,EURO,0,12905,33165000-4,DA7327575,DIRECTIA GENERALA DE ASISTENTA SOCIALA SI PROTECTIA COPILULUI SECTOR 6
,SISTEM ELONGATII TRITON ,"Strada Cernișoara 38, București 061019, Romania",44.439322,26.02298,SC ROMLAB SRL,2015-09-24,,8655.89,EURO,0,12976,33192150-8,DA7325827,DIRECTIA GENERALA DE ASISTENTA SOCIALA SI PROTECTIA COPILULUI SECTOR 6
,INTELECT SHORTWAVE 100 ,"Strada Cernișoara 38, București 061019, Romania",44.439322,26.02298,SC ROMLAB SRL,2015-09-24,,8409.82,EURO,0,12894,33158400-6,DA7327666,DIRECTIA GENERALA DE ASISTENTA SOCIALA SI PROTECTIA COPILULUI SECTOR 6
